{
  "version": 1,
  "project": "passing-fixture",
  "checks": [
    { "name": "pass", "command": "powershell", "args": ["-NoProfile", "-Command", "exit 0"] }
  ],
  "securityChecks": [
    { "name": "secret-scan", "kind": "secret", "command": "powershell", "args": ["-NoProfile", "-Command", "exit 0"] }
  ]
}
